Data_Hora,ID,Tweets
2023-04-18 18:23:20+00:00,1648391779840827405,@FlavioBolsonaro Torcendo sempre contra a economia do Brasil.Verme
2023-04-18 18:23:17+00:00,1648391767035723776,"… Governo do Estado, vai potencializar a economia já existente na região e criar novos negócios, gerando emprego, renda e mostrando para todo o Brasil as belezas naturais desta nova rota turística do município! https://t.co/wXaiwpdEtR"
2023-04-18 18:17:49+00:00,1648390390955876352,a economia do Brasil é uma piada
2023-04-18 18:16:41+00:00,1648390104648392721,Economia de baixo carbono é oportunidade para reindustrializar o Brasil https://t.co/jiSBRJkIFA
2023-04-18 18:15:29+00:00,1648389804483026944,"se vini jr marcou hj, brasil fica top 1 economia do mundo"
2023-04-18 18:15:20+00:00,1648389764272345092,"@Kristofer_eng @clarionrox A China é muito mais sólida que os outros. Brasil, India e Africa do Sul são democracias, são sucetiveis a interferencia e troca de governo, e a Russia está envolvda em conflitos o que acaba com a economia deles"
2023-04-18 18:12:50+00:00,1648389136909303809,"👀 AFF O BRASIL VIROU PALCO DOS DESMANDOS..ninguém tem mais sossego..
Escolas/fazendas/economia/diplomácia... https://t.co/B0boaNCGrU"
2023-04-18 18:11:48+00:00,1648388876166111236,"@LulaOficial @KlausIohannis @ricardostuckert O Brasil é um dos países q mais consome games no mundo, além do forte crescimento do segmento profissional na área que acelera a economia e gera empregos! Desejo de verdade que se retrate a respeito e mostre pro povo q está apto a aprender!"
2023-04-18 18:10:45+00:00,1648388611677597696,O Haddad bem que podia ser o primeiro ministro da economia mudo do Brasil
2023-04-18 18:08:56+00:00,1648388153755967501,"@LulaOficial @KlausIohannis @ricardostuckert Cagao de medo do Bolsonaro 
Lula destruindo a economia do Brasil e reelegendo Bolsonaro pela esposa.
Lula velho gaga que está destroçando o brasil"
2023-04-18 18:08:55+00:00,1648388151046447127,"E hoje o Brasil descobre que tem uma nova Primeira Ministra que manda e desmanda da economia à comunicação da República. 
Que desastre."
2023-04-18 18:01:10+00:00,1648386199336230912,"BRASIL SÓ RETOMARÁ uma boa Economia, NO DIA QUE BAIXAR OS ALTOS JUROS E IMPOSTOS E NÃO INVENTAR MAIS TAXAS. E NÃO INVENTAR MAIS TAXAS! @LulaOficial @Haddad_Fernando"
2023-04-18 18:00:45+00:00,1648386097548783617,"💡🌎 A produtora francesa de energia limpa @VoltaliaSA planeja investir US$ 800 milhões no 🇧🇷 Brasil para acelerar a energia renovável na maior economia da América Latina, de acordo com @climate. 🌱

#iqoption #energialimpa #sustentabilidade #voltalia #brasil #economia"
2023-04-18 17:58:07+00:00,1648385431342293000,"Sério  isso ? isso é um problema grave sobre a questão de consoles ? Só para lembrar  que o Brasil é o terceiro consumidor de games do mundo , isso gera emprego e aquece a economia .
Eu sou fã de games desde criança e continuo jogando o PS4.
Namoral , que discurso desnecessário. https://t.co/SV7J7nbezC"
2023-04-18 17:57:48+00:00,1648385353470836737,"Valter Pomar - Professor de Economia Internacional analisa a repercussão da viagem de Lula à China e a visita do Chanceler russo no Brasil. O Brasil não está em guerra e mantém relações diplomáticas com o mundo.
O BRASIL VOLTOU! 
https://t.co/ihluAvFZvf"
2023-04-18 17:56:51+00:00,1648385114584260609,"MEIs, micro, pequenos e médios e terão mais capacidade de investimentos.  É o Brasil se reerguendo, alavancando sua economia. https://t.co/DHWtotPZbh"
2023-04-18 17:55:07+00:00,1648384677810454528,"Ei genteeeeee otima tarde a todos. Deus esteja no comando de nossas vidas.
Concordam?
Brasil e Argentina parecem dois bêbados cambaleantes a cabecear nos postes. Só que, enquanto a Argentina parece estar a caminho da economia de mercado, o Brasil parece estar de volta ao bar."
2023-04-18 17:54:00+00:00,1648384398012678144,"@AnaMartinsGomes Não está formatado como vocês, defende o seu Brasil, ao contrário da vossa política belicista que vais destruindo a economia da UE"
2023-04-18 17:52:18+00:00,1648383969174364166,"@FlavioBolsonaro A economia vem primeiro agora, vamos reerguer o Brasil, a CPMI de 8 de janeiro podemos ver depois...."
2023-04-18 17:49:23+00:00,1648383236362346511,@tt_SPFC @eixopolitico O Brasil continua sendo um dos países com economia mais fechada do mundo.
2023-04-18 17:47:28+00:00,1648382753400823811,"@FMouraBrasil Lula, “DOUTOR” self-honoris causa, declara que “os livros de economia estão ultrapassados”.

Janja e seu consorte se merecem.
Parabéns e muito obrigada por TUDO! 🍾🥂
Ainda há jornalistas no Brasil. Graças a Deus."
2023-04-18 17:46:38+00:00,1648382541450059788,"Caro senhor @LulaOficial, acredito que a equipe que lhe deu acessória nesse sentido está errada. O senhor tem noção dos números econômicos relacionados a esse mercado? Antes de falar qualquer coisa é melhor conhecer. O Brasil se faz de cego para mercados enormes na economia."
2023-04-18 17:44:55+00:00,1648382111940837399,"@joicehasselmann Esquerdistas: foda_se pobre não come jato

Leitão: economia: a vantagem de não exportar  mais jatos pro Brasil 

Bosta Neto: não me peçam pra criticar meu chefe, sou blogueiro de crachá 😁"
2023-04-18 17:43:30+00:00,1648381756184166408,"@destroyed1989 Eu assisti alguns vídeos e pode ser uma boa, uma vez que, alguns produtos podem ficar mais barato no Brasil e, consequentemente, melhorar nossa economia já que as exportações entre os países do BRICS não vai ser em dólar mas com uma moeda própria dos integrantes do grupo..."
2023-04-18 17:40:41+00:00,1648381045178335250,"Pra se entrar em briga armada tem de ter bala na agulha, também. 
Cada um trabalha com o que tem: o Brasil, por ora, tem a diplomacia falada. Tivesse uma economia como outros e um arsenal, também, de repente não haveria essa cobrança dúbia..."
2023-04-18 17:40:40+00:00,1648381043563528205,"""Para o Brasil, chamei de Resgate da função social da economia: uma questão de dignidade humana. Quão fundo devemos afundar no caos global antes que surja energia política suficiente para a mudança?

Por Ladislau Dowbor para o Meer | Tradução: Maurício Ayer"
2023-04-18 17:38:59+00:00,1648380616587591699,@LairinhaRed @felipeneto Com certeza o povo vai dar muito valor para um vídeo feito pelo Felipe Neto explicando sobre a economia do Brasil...kkkkkkkkkkkkk
2023-04-18 17:37:50+00:00,1648380330250846214,"A Associação Brasileira de Supermercados (ABRAS) anunciou na noite de 17 de abril o Ranking ABRAS 2023, que retrata o desempenho das empresas do setor supermercadista no ano de 2022.#Abras #Economia #EconomicNewsBrasil #Ranking #Supermercado #Varejo

https://t.co/jNY09Wgn2C https://t.co/NZY4dDG3GA"
2023-04-18 17:37:03+00:00,1648380131776380934,"Bora?

Temporada de cruzeiros no Brasil injeta R$ 3,6 bilhões na economia | O TEMPO
 https://t.co/J0SsMeBM9Y via @vuejs"
2023-04-18 17:35:57+00:00,1648379853354278912,"@tt_SPFC @eixopolitico O Brasil deve ser o único país do mundo que 60 milhões de eleitores acham que um c0rr upt0    alc0 ól@tra    c0nd£ nad0  s£mi an@lfab£t0 vai alavancar a economia do país taxando os pobres.
🤡 🤡 🤡 🤡 🤡 🤡"
2023-04-18 17:35:42+00:00,1648379792461381664,"@LulaOficial larga o populismo, essas empresas são um risco para a economia do Brasil."
2023-04-18 17:34:23+00:00,1648379462189301768,"@felipeneto O Brasil, como é  uma economia ""super aberta"" tem de taxar e taxar tudo que vem de fora pra estimular a economia interna, principalmente quem ganha 1 a 3 salários pra combater a sonegação de empresas chinesas, já que nada do que produzimos aqui é manufaturado na China 🤣🤣🤣🤣🤣"
2023-04-18 17:30:28+00:00,1648378475252793374,"@electronics732 @ginlherme @cibelecerq Jesus... Moça, qlqr moeda precisa de lastro na economia de determinado estado, por muito tempo o Brasil teve sua economia lastreada principalmente na produção de laranjas, hj no setor agrícola como um todo, o fato é q sem povo não há estado e moeda impressa sem lastro é só papel."
2023-04-18 17:28:33+00:00,1648377991016202240,"A socialite de estimação da imprensa brasileira venceu a queda de braço com o Ministro da Economia.

Fernando Haddad atendeu a primeira dama Esbanja Lula da Silva e desistiu de taxar os sites de compras chineses.

O Brasil é uma bagunça."
2023-04-18 17:20:39+00:00,1648376006678396949,"o foda era que taxar ia beneficiar muito os comerciantes do Brasil e isso iria ajudar na economia, pena que tem os contras quando se trata de ser mais acessível ne"
2023-04-18 17:20:00+00:00,1648375840974028800,"Lula sendo duramente critica por ser contra uma guerra pela União Europeia e EUA. Engraçado que culminando com acordos com a China e retirando eles de protagonismo no Brasil. Bando de verme jogando a economia mundial em uma guerra desnecessária. Atrasados, fúteis como a imprensa"
2023-04-18 17:18:52+00:00,1648375554628894723,"Temporada de cruzeiros injeta R$ 3,6 bi na economia brasileira https://t.co/zvJyCtT9hL Ana Cristina Campos – Repórter da Agência Brasil  - Agência Brasil https://t.co/wNTtnxq012"
2023-04-18 17:12:56+00:00,1648374060777193488,"@infomoney Pessoal tá gastando o Auxílio Brasil 😉 em jogos de azar, mas tem quem ache isso bom para economia."
2023-04-18 17:11:07+00:00,1648373606961889295,"trabalho com um cara que ""entende"" TUDO mas principalmente economia.. cheguei tá o bonito falando ""estava te esperando pra debater os últimos posicionamentos do governo pq as falas de Lula estão mt perigosas"" respondi que O BRASIL SOBERANO E CADA CACHORRO QUE CUIDE DE SUA CACETA"
2023-04-18 17:10:31+00:00,1648373453160849408,"#repost Um inédito Crédito de Carbono Integral é uma das inovações em estudo no Lab de Economia Regenerativa da Caatinga, unindo empresas, ongs, centros acadêmicos, cooperativas, comunidades e governos (políticas públicas).

Saiba mais no link:
https://t.co/xjqNXwhrU5 https://t.co/UROX2wg9Qt"
2023-04-18 17:08:08+00:00,1648372854591832067,"@flaviofachel Amo a Shein! Hahahaha olha, nada entendo de economia, mas nao seria melhor baixar os impostos daqui, para comprarmos mais barato no Brasil? É surreal pagar R$ 250 numa calça da Renner, Riachuelo, C&amp;A..."
2023-04-18 17:02:47+00:00,1648371509822468096,"@AnibalGarzon EU se dio cuenta demasiado tarde que Brasil forma parte del BRICS desde hace muchos años y que nadie dava valor alguno a esta agrupación que ahora está haciendo que cambie el mundo de manera pacífica con la desdolarizacion de la economía, EU pierde preponderancia mundial"
2023-04-18 17:01:34+00:00,1648371201251721226,@Haddad_Fernando O rei das taxas. Impeachment já pra esse governo que está acabando com a economia do Brasil. O pior entre os piores.
2023-04-18 17:00:04+00:00,1648370825492418561,"@Adeh_olive Eu seria a favor sim, mas que baixasse a quase 0 os impostos dentro do país, fazendo formentar a economia no qual todos sairiam ganhando, mas como eu disse não estamos em Nárnia, na real eles querem arrecadar o máx, pq o custo Brasil aumentou em muito, é muita gente para bancar."
2023-04-18 16:57:03+00:00,1648370064582754318,@GeneralMourao O Brasil continuará uma economia Pujante ??????
2023-04-18 16:52:38+00:00,1648368954014941200,"@SuperRafinha_ Ele não vai.
A economia do Brasil é voltada pro consumo doméstico.
Você realmente acredita que o velho da Havan vai deixar um buraco no varejo pro seu concorrente?
Por favor..."
2023-04-18 16:52:06+00:00,1648368819088375818,"Estão destruindo a Economia do Brasil.
Este Arcabouço é um desastre
Impeachment Já 
@BancoCentralBR @Biakicis @rodrigopacheco @ArthurLira_ 
Lula está perdido"
2023-04-18 16:48:17+00:00,1648367859188346880,"Vc sabia? A pandemia afetou todo o mundo, mas no Brasil, um governo inapto que está preocupado em realizar acordos com o centrão, a queda na economia foi muito pior que outros países 
 https://t.co/jOJpK1S0p4"
2023-04-18 16:45:21+00:00,1648367120370024450,"@barbarapessoal A bagunça na Economia ganha mais esse vexame.
Estava tudo em céu de brigadeiro, agora .... 
Esses cretinos almofadinhas isentões colocaram nosso Brasil de volta para o chão.
Na verdade não foram eles, foi outra coisa, mas eles endossaram a ""outra coisa"".
Patetas!"
2023-04-18 16:41:22+00:00,1648366119521067008,"Deixo e explico 3 motivos para você ficar atento e pensar em se expor no agro:

1. Relevância na nossa economia. Além disso, o Brasil é o terceiro maior produtor de alimentos do mundo, exportando para mais de 180 países. https://t.co/ox9kWRl7aJ"
2023-04-18 16:40:36+00:00,1648365924448174081,"Shein, Shopee e AliExpress: Governo volta atrás e mantém isenção para encomendas internacionais de até US$ 50
#Brasil #Consumo #Economia
https://t.co/yTz9Yd6H8J"
2023-04-18 16:39:22+00:00,1648365617282531340,"@Beaasatoru Por ai, eu faço palestras de economia para empresas no Brasil"
2023-04-18 16:36:28+00:00,1648364884197883907,"@FriedHardt Nossa Ministra da Economia Doméstica é sensacional!
Sempre pensando nos pobres do nosso Brasil!
O GIGANTE ACORDOU!"
2023-04-18 16:35:15+00:00,1648364581172002820,"A coisa está feita e melhor fazer economia, porque o desgoverno veio para quebrar o Brasil. https://t.co/arSEla1wF7"
2023-04-18 16:34:04+00:00,1648364280058724353,"Assim como Jair Bolsonaro, o presidente Lula se comunica muito mal com a imprensa e errou feio em suas colocações sobre o conflito entre Rússia e Ucrânia.

Uma das principais características do Brasil é o de se manter neutro em temas sensíveis no mundo. 

https://t.co/HK2e3aVDdb"
2023-04-18 16:33:58+00:00,1648364256490930178,@lucasllach Brasil… tasas de 591% o 628% cuidan la economía y el bolsillo de la gente? https://t.co/MfCo0jWdhE
2023-04-18 16:31:21+00:00,1648363598853406721,"BRASIL A FAVOR DE RUSIA... SEGÚN SU PORTAVOZ, LULA
LULA ES EL PORTAVOZ DE BRASIL
¿Y AHORA Q VAN A HACER BRASILEÑOS?
SE LES VA A VENIR ABAJO SU ECONOMÍA"
2023-04-18 16:30:09+00:00,1648363294380691456,"Governo recua e mantém isenção para compras internacionais entre pessoas físicas até US$ 50, diz Haddad | Economia #Aprizion https://t.co/TR3SMMzOK0"
2023-04-18 16:27:00+00:00,1648362505075400705,"Não vai ficar barato! Será que Lula está querendo usar os EUA para culpá-los por tudo que acontecer na economia. Venezuela, Cuba …vivem com esse expediente. EUA querem que Brasil explique ‘alinhamento’ com Rússia sobre invasão à Ucrânia; leia bastidores
https://t.co/BHCPoINYo2"
2023-04-18 16:25:35+00:00,1648362147469049864,"CHINA CRESCE 4,5% NO 1º TRIMESTRE. BOM PARA O BRASIL E PARA O MUNDO
Resultado da segundo maior economia do planeta veio acima do esperado pelo mercado. PIB avançou forte com o fim das restrições impostas pela política de ‘Covid Zero’
https://t.co/rA27ubWWUf"
2023-04-18 16:23:37+00:00,1648361652914470912,"@LopesGarcia1986 @sc_tuga Eu digo
O Brasil não é só maior
É melhor.
Tu não passas da 22ª economia da Europa toda. Só São Paulo é a 21ª do MUNDO
Mas continua a lamber o cu ao norte"
2023-04-18 16:21:59+00:00,1648361241960759301,"@dai_tama E chega dessa farsa de austeridade. O problema não é despesa, é justamente o contrário, é receita. 

Para termos equilíbrio, o problema principal não é gastos sociais, é o crescimento da economia e da arrecadação. Inviáveis por causa dos juros.

O Brasil todo paga juro assassinos"
2023-04-18 16:20:28+00:00,1648360859587035142,"@luisstradae Que la principal economía de AL es Brasil (hasta ahora), y estamos mucho mejor que ellos… https://t.co/uI2aDICqFj"
2023-04-18 16:20:22+00:00,1648360834379268121,"Oposição #pressiona #Pacheco a #manter #sessão do #Congresso #para #criar #CPMI do 8/1         O presidente ... Saiba mais sobre ese conteúdo no site Brasil em Pauta Noticias.
Clique no Link: https://t.co/gqU1eBcHn5 #brasil #economia #política https://t.co/51XnqbGiUP"
2023-04-18 16:19:44+00:00,1648360674995712002,"Toffoli #vota #por #tornar réus 100 #presos por #atos de #vandalismo de 8 de #janeiro         O ministro ... Saiba mais sobre ese conteúdo no site Brasil em Pauta Noticias.
Clique no Link: https://t.co/wnDIzZuHVV #brasil #economia #política #reus https://t.co/oiyMN9Zgt1"
2023-04-18 16:19:39+00:00,1648360655399927808,"@mlmatheus3 @bymuriloo @zdarkyoshi rapaiz pelo menos n teve que sair colocando imposto em tudo e após 600 mil mortes,que o seu presidente chamou de ""gripezinha""temos menos pessoas para fazer a economia girar fazendo assim o PIB do Brasil cair e temos que resolver de algum jeito né 
PIB:produto interno bruto"
2023-04-18 16:19:05+00:00,1648360510310563841,"#Após #papelão de Lula, #Ucrânia #volta a #convidar #presidente a #Kiev         Inconformado com as atitudes do ... Saiba mais sobre ese conteúdo no site Brasil em Pauta Noticias.
Clique no Link: https://t.co/TLEIbolrko #economia #política https://t.co/NILBDRpKPs"
2023-04-18 16:18:27+00:00,1648360350952112129,"Relator #vota #para #tornar réus 100 #denunciados #por #atos de #vandalismo         O ministro Alexandre ... Saiba mais sobre ese conteúdo no site Brasil em Pauta Noticias.
Clique no Link: https://t.co/IzIMYOqsYc #brasil #economia #política #reus https://t.co/bIlHjSi7I9"
2023-04-18 16:18:00+00:00,1648360237114458115,"#Economía |  40 operadores turísticos de Brasil visitaron la isla Margarita 

Amplía la información aquí: https://t.co/bcPMICfMKp 

#NoticieroVV #18Abr https://t.co/bybIYIQ9VF"
2023-04-18 16:17:44+00:00,1648360171414994950,"PF #volta #às #ruas #para #prender 16 #por #ataques a #Poderes em 8 de #Janeiro         Por ordem do Supremo ... Saiba mais sobre ese conteúdo no site Brasil em Pauta Noticias.
Clique no Link: https://t.co/RNIhbLWtTb #brasil #economia #política https://t.co/k9u0Vc9m8c"
2023-04-18 16:17:05+00:00,1648360009217064965,"Sem-terra #fazem #invasões #criminosas no #Espírito #Santo e #Pernambuco         Ativistas ... Saiba mais sobre ese conteúdo no site Brasil em Pauta Noticias.
Clique no Link: https://t.co/dhg4wxmX4X #brasil #economia #política #semterra https://t.co/b4MpRTk6c6"
2023-04-18 16:16:38+00:00,1648359892682506241,"Moraes #vota #para #tornar réus 100 #denunciados #por #ataque a #Poderes 
        O ministro Alexandre ... Saiba mais sobre ese conteúdo no site Brasil em Pauta Noticias.
Clique no Link: https://t.co/4wPSi4zJXY #brasil #economia #política #reus https://t.co/4pIZ99QZKk"
2023-04-18 16:16:31+00:00,1648359863620190210,E a política segue atrapalhando a economia no Brasil...
2023-04-18 16:15:08+00:00,1648359515010764800,"Governo recua e mantém isenção para comércio internacional entre pessoas físicas até US$ 50, diz Haddad | Economia +News: https://t.co/vXMz1nNgUd | #NewsTuneinBR https://t.co/vBZDMgc8B7"
2023-04-18 16:12:21+00:00,1648358817770483720,Receita fará leilão com quilos de ouro e diamantes apreendidos em Guarulhos  #economia
2023-04-18 16:07:02+00:00,1648357478126481409,@tt_SPFC @eixopolitico Alavancar economia: comprar produto feito na China que vem pro Brasil e ganha um carimbo da Multilaser
2023-04-18 16:04:51+00:00,1648356930673319937,Ministro da Economia não é um emprego legal no Brasil.
2023-04-18 16:04:37+00:00,1648356870174720000,"@theonering91 Es cierto, pero eso es desde un sector de la economía de menor generación de divisas que las exportaciones de procesados y manufacturas
Respecto a lo segundo, va en línea con el deseo de convertir a Brasil en un país de peso global"
2023-04-18 16:03:36+00:00,1648356613579841538,@eixopolitico O Brasil deve ser o único país do mundo que tem Patriotas que odeiam o próprio país e que preferem alavancar a economia dos outros.
2023-04-18 16:03:23+00:00,1648356560870031361,"GDF define datas de expiração de créditos do Vale-transporte https://t.co/oCLmpJXKfW

#radardf #distritofederal #brasil #df #gdf #ultimasnoticias #noticias #radarpolitico #politica #economia #mundo #culturaeesporte #cidadesdodf #entorno"
2023-04-18 16:00:10+00:00,1648355748303482882,"Governo recua e mantém isenção para comércio internacional entre pessoas físicas até US$ 50, diz Haddad | Economia #Aprizion https://t.co/TR3SMMzOK0"
2023-04-18 16:00:06+00:00,1648355733476462593,"@antonio96026924 Engano,  quem cria e lucra com as guerras no mundo sempre foram os americanos. O que que o Brasil ganhou até agora sendo quintal desses caras? Lula está certo. Vamos desdolarizar a economia."
2023-04-18 15:56:26+00:00,1648354812604342273,"@choquei Que pena, como @choquei mesmo disse, era bom pra economia do Brasil. Então o Lula esta tomando uma decisão que prejudica o Brasil. 😆😆"
2023-04-18 15:56:04+00:00,1648354719247613959,"@folha E quem não arrisca não sai do lugar!

O que as grandes mídias estão ganhando em querer o Brasil submisso aos EUA e perante a economia mundial?

Querem um Brasil pobre, mal alimentados e sucateado!!! https://t.co/yXjj1XfO7L"
2023-04-18 15:54:59+00:00,1648354447053955072,"https://t.co/2ftoqS4Uu1

#FMI #brasil #economia"
2023-04-18 15:53:25+00:00,1648354049752719363,"@GloboNews @betepacheco_ @LeilaneNeubarth @camilabomfim Nem é economista e não terminou um cursinho de três meses, mas é adorado pela mídia do ""consórcio"". Vai afundar a economia do Brasil, mas é a destruição do bem. #Foralula"
2023-04-18 15:53:07+00:00,1648353975807143936,"A receita com petróleo triplicou no Brasil, chegando a 3% do PIB, o maior patamar desde 2014. O aumento do preço internacional do petróleo impulsionou a arrecadação com royalties e participações especiais. #Petróleo #Economia #Brasil Leia mais em: https://t.co/7Fun5NRYl6"
2023-04-18 15:52:59+00:00,1648353941980078088,"@KaguetaBR @Mariana93368734 @TerraBrasilnot Vamos lá, primeiro ponto você não vê nada de positivo nos acordos que o pt já fez? Então como justifica o Brasil ter conseguido alcançar o posto de 6° economia do mundo e depois do pt isso nunca mais conseguir ser alcançado? (Cont)"
2023-04-18 15:50:07+00:00,1648353219289010176,"Mas sabia que existem algumas empresas que não são tão expostas ao “risco Brasil”?

Algumas empresas são dolarizadas e não dependem tanto da economia local.

Vou deixar um relatório pra vocês mostrando que empresas podem ter um bom desempenho em qualquer cenário."
2023-04-18 15:47:53+00:00,1648352657801723904,"En la economía MUNDIAL en estos momentos lo crucial es la LUCHA que sostienen las MONEDAS, la 5R contra el D,
RUSIA con el Rublo, INDIA con la Rupia, Brasil con el Real, CHINA con el Renminbi y SUDÁFRICA con el Rand contra el Dólar.
*Guerra de PAPELES. https://t.co/dyvuVm8gs7"
2023-04-18 15:47:03+00:00,1648352449118216192,"@gleisi 100 dias de desgoverno
100 dias usufruindo do dinheiro alheio...cama e sofá caros...diárias de hotéis absurdas. Economia afundando e o Brasil sendo entregue pra China. #OBrasilvoltouaserroubado"
2023-04-18 15:46:32+00:00,1648352320906821634,"@DrBrunoGino O amor venceu, volta pro Brasil e vai fazer plantão em posto d saúde do interior da Bahia. Ficar cagando virtude pela internet morando em pais d economia liberal e moeda forte só mostra q vc é um hipócrita"
2023-04-18 15:43:15+00:00,1648351492804321280,"Já tava na hora, a economia precisa aquecer, estamos pendurados por um fio kk"
2023-04-18 15:42:40+00:00,1648351345550716928,"Muchas respuestas sobre la importación de fertilizantes rusos a Brasil y el peso de sus exportaciones agrarias
Agradezco el aporte
Pero la economía brasilera es mas compleja y sus exportaciones mas variadas de lo que se piensa https://t.co/oXQJloWm4o"
2023-04-18 15:39:22+00:00,1648350516642996224,"@arthurphellipe_ @jv_szz Levantaram e no mesmo momento caiu por terra, que nem a taxação da shoppe. O Bolsonaro foi um merda completo e um dos piores presidentes da história do Brasil, mas o lula não entende NADA de economia e quer taxar tudo"
2023-04-18 15:38:34+00:00,1648350314477568003,"Impeachment de @LulaOficial  Já 
O Brasil está desmanchando .
Economia em Crise
Crise Social .
Crise Internacional 
Chega ! Basta !
@rogeriosmarinho @rodrigopacheco @marcosdoval @marcelvanhattem @MagnoMalta @lpbragancabr"
2023-04-18 15:33:40+00:00,1648349080014168064,"@luisrosanews O Brasil vai ficar debaixo da ""pata"" dos chinas como Angola, quando eles começarem a desembarcar com contentores e a dominarem a vossa economia, vão chamar pelo Lula."
2023-04-18 15:33:10+00:00,1648348954810089474,"@_LobisomemPidao Eu particularmente não concordo com a Rússia e China em aspectos políticos, mas dizer que não é bom pra economia do Brasil é loucura."
2023-04-18 15:31:37+00:00,1648348565025042432,"@malu_psi @andretrig @PedroVoge Vai ver quanto é a divida interna do Japão,  a maior do mundo , lá o Estado subsidia a economia e o mundo não reclama do gasto público porque é aliado americano e é território estratégico,  já o Brasil reclamam porque é território servil pra rentista lucrar em cima do povo"
2023-04-18 15:30:08+00:00,1648348193543823362,"@helenachagas ""Sempre tento dizer isso!!
 Lula por Conceição Tavares - ""Ignorante, coisa nenhuma. O Lula sabe mais do Brasil do que ninguém. E sabe mais de economia aplicada, prática, do que ninguém"". https://t.co/oRzHIHcNVv"
2023-04-18 15:30:00+00:00,1648348158261428225,"Vendas internas tiveram alta de 2% no período, e exportações caíram 6,1%, segundo dados do Instituto Aço Brasil

https://t.co/YTd5BM52eY"
2023-04-18 15:29:37+00:00,1648348061289070592,"@gleisi A Amante,  vomitando.mais asneiras.
Seu conhecimento de economia é tão verdadeiro quanto seu caráter!!!"
2023-04-18 15:28:17+00:00,1648347727313489921,"Aumento do salário mínimo pode injetar R$ 9,5 bilhões | https://t.co/0m3KJBiThx #Brasil #economia #dinheiro"
2023-04-18 15:26:33+00:00,1648347289444818944,"@Victori89725962 @endireitabrzil Reitero: Se a economia do Brasil tá alavancando, você é bolsonarista"
