Data_Hora,ID,Tweets
2023-04-18 01:53:35+00:00,1648142701739536389,"@_NOALCOMUNISMO Porque Brasil es el gigante del sur y la segunda economía del Continente y eso le da ""dolor de cabeza"" a la primera economía del planeta.Los demás países de este Continente aliados del jefe del #Kremlin no le produce ""jaqueca"" al octogenario primer mandatario d la súper potencia."
2023-04-18 01:53:09+00:00,1648142592205357056,"O Banco Interamericano de Desenvolvimento (BID) aprovou nesta quinta-feira uma linha de crédito para projetos de investimento na Argentina no valor de US$ 600 milhões (R$ 2,9 bilhões) a ser destinada a setores como o da saúde, disse o ministro da Economia do país, Sergio Massa."
2023-04-18 01:49:31+00:00,1648141675804479488,"@Estadao @EstadaoEconomia As vezes eu queria que o BC cedesse as exigências do Lula. Assim a economia se quebraria de uma vez e a gente fazia o impeachment logo. O Brasil ia sofrer, mas não seria pior do que 4 anos disto..."
2023-04-18 01:48:42+00:00,1648141471147606017,"Eduardo Oinegue participa do BandNews: Edição da Noite com Eduardo Castro e fala sobre as projeções para o futuro do Brasil, analisando a economia e o momento político do país.

#BandNewsTV #EduardoOinegue https://t.co/PTuxc4n4S1"
2023-04-18 01:47:18+00:00,1648141120252137474,@SF_Moro Ajudou a DESTRUIR a economia do Brasil
2023-04-18 01:40:00+00:00,1648139281003696130,"Brasil atinge recorde de US$ 36 bi na exportação do agronegócio no 1º tri, diz ministério
https://t.co/6FKqMcdupf"
2023-04-18 01:39:27+00:00,1648139145674477570,agora eh só taxar o onlyfans e pronto brasil maior economia do planeta
2023-04-18 01:38:18+00:00,1648138855432744960,"@md__tips reclamavam do Paulo Guedes, mestre em economia e colocaram o pior prefeito de SP no lugar

Brasil merece isso @md__tips, e estamos só no 4o mês do primeiro ano de governo, pode saber que o buraco é muito mais embaixo."
2023-04-18 01:33:20+00:00,1648137606020866049,sobre a economia do Brasil. Meu deus kkkkkk
2023-04-18 01:31:10+00:00,1648137059264081922,"@iaragb @kimpaim A indústria já tá uma mal não é de agora, sem incentivos, economia instável e ainda pandemia, mas emprega milhões de pessoas, desinsdustrializar não é coisa pra pouco tempo não, de certo é q o Brasil tá sendo loteado, no melhor estilo da colonização, os gafanhotos são vorazes"
2023-04-18 01:27:36+00:00,1648136160982515717,"@coelho_brasil Capitalista também gosta de dinheiro, a diferença é que na ânsia de ganhar dinheiro, gera riqueza, faz girar a economia, gera empregos. Comunista esta sempre pensando em um jeito de arrumar dinheiro sem esforço."
2023-04-18 01:26:37+00:00,1648135912348327938,"A analista de economia da CNN @raquellandim e os comentaristas Janaina Paschoal, Helio Beltrão e Joel Pinheiro debatem se o retorno do imposto sindical seria um retrocesso na reforma trabalhista #CNNArena https://t.co/a3lBMtFECx"
2023-04-18 01:25:34+00:00,1648135649336123395,"Em 100 dias de desGoverno o Lula afundou a economia, arrumou dívida com Ditaduras e colocou o Brasil no meio de uma guerra! Parabéns aos envolvidos 👏🏻👏🏻 #fazueli #LulaLadrao #voltabolsonaro"
2023-04-18 01:24:52+00:00,1648135475608141825,"@ASFGamer1 @philliphonorato Com um economia como o Brasil, nunca vai existir uma solução, o problema do Brasil é o Brasil."
2023-04-18 01:20:55+00:00,1648134481268621318,"@Ricardo_Cd_Oliv @MacaesBruno De que adianta essa bosta toda se não tem distribuição de renda, camarada? O Brasil sempre esteve entre as 10 maiores economia (tem hoje o PIB americano dos anos 80), e os BRICS têm a maior concentração de dinheiro do mundo. De nada vale sem distribuição de renda!"
2023-04-18 01:20:17+00:00,1648134319012020226,"@emilsonsampialh @JorgeStolfi @LeonardooPaivaa @mspbra Agora entendo porque dizem que quando queimarem o departamento de economia da Unicamp o PIB do Brasil cresce 5%, e mais 1% adicional quando salgarem as ruínas."
2023-04-18 01:15:01+00:00,1648132994224254978,"@profurbani @Kazy112012 @KPR_Brasil Mas isso só mostra a fragilidade de uma corrente ideológica fraca.

É como na evolução, uma espécie morre pq outra é mais adaptada e ganhou.

Se a economia socialista funcionasse, ela iria prosperar e atropelar o capitalismo. Falta de tentativa que não foi."
2023-04-18 01:13:43+00:00,1648132666376552448,"Até o Brasil q costuma ser suave com os EUA entrou nessa, o grande poder dos americanos vinha justamente do dolar.
Fora a aproximação q teve entre Rússia e outros países sancionados fazendo uma economia paralela q os EUA n pode sancionar."
2023-04-18 01:13:00+00:00,1648132487510368260,@luiisuai realidade do Brasil em quase toda guerra que se envolveu: quero todos tomem no cu e minha economia cresça
2023-04-18 01:03:00+00:00,1648129972920360962,"Sem a aprovação do novo arcabouço fiscal, haverá espaço de somente R$ 24 bilhões para gastos livres. Trecho do Jornal Nacional, da TV Globo, em 17/04/2023. #noticias #política #informação #Economia https://t.co/dSzz9YXLbw"
2023-04-18 00:54:58+00:00,1648127949135044608,"@guilherme_amado Corretos, a economia do Brasil já está boa pra taxar ainda mais as coisas né"
2023-04-18 00:45:38+00:00,1648125600295444480,"@SF_Moro E digo mais, boa parte da população brasileira não tem a noção da desgraça que vc e o pastor Dandan fizeram na economia desse país. E só serviu para uma coisa: fazer eclodir o nazifacismo no Brasil. A justiça será feita."
2023-04-18 00:42:42+00:00,1648124861653426177,"@o_gabsferreira @sseraphini No Brasil eu acho que o governo Lula vai ser um governo meio engessado porque falta dinheiro pra investir e pq o congresso tá mais contra que a favor.

Mas também não acho que piora. Nem melhora. Estagnado. 

A economia não vai parar. O setor de ti deve reaquecer no 2o semestre."
2023-04-18 00:41:31+00:00,1648124565481050112,"nao é uma medida ruim, mas tbm não incriticável. taxar produtos de fora (importação) ajuda MUITO no crescimento da indústria &gt;nacional&lt; e qnd pensamos num plano de industrialização do Brasil, isso é BOM. Pq a longo prazo o desenvolvimento da indústria ajuda na economia do país e+"
2023-04-18 00:38:07+00:00,1648123709901643779,"@AngelicaLozanoC Inteligentemente Brasil refuerza lazos con los países llamados a dominar la economía mundial, la geopolítica y las nuevas instituciones que se crearán. Es lo que debería hacer Colombia, mirar más allá de estados unidos y ampliar la baraja de socios"
2023-04-18 00:37:15+00:00,1648123489981722626,"@vanglockkk nao é uma medida ruim, mas tbm não incriticável. taxar produtos de fora (importação) ajuda MUITO no crescimento da indústria &gt;nacional&lt; e qnd pensamos num plano de industrialização do Brasil, isso é BOM. Pq a longo prazo o desenvolvimento da indústria ajuda na economia do país e+"
2023-04-18 00:36:57+00:00,1648123414865903617,"@DielAlvesl Melhor caminho: um projeto de desenvolvimento nacional que garanta soberania nacional. Perspectivas de curto prazo na economia são fundamentais, mas é preciso pensar a longo prazo tbm. E isso passa por deixar claro que o Brasil não é obrigado a seguir a linha ideológica doa EUA."
2023-04-18 00:35:57+00:00,1648123162175913984,"O que as vezes parece imperceptível em alguns debates que se popularizam muito - a supremacia branca brasileira é, exatamente, a burguesia neoliberal que cobra pretensa responsabilidade fiscal e diz que alimentar pobre vai destruir a economia do Brasil."
2023-04-18 00:33:31+00:00,1648122551573389312,"Imposto de Renda 2023: 14 milhões de declarações já foram entregues; veja como declarar e não cair na malha fina
#Brasil #Economia #FeedPrincipal
https://t.co/T7fLzodn6d"
2023-04-18 00:31:42+00:00,1648122093802774528,"@Paulo_Vallim @Alice_inland13 Diminuiu a extrema pobreza,pib fechou em alta,a economia fechou melhor que a china,a inflação mais baixa que a dos estados unidos,a transposição do rio são Francisco,rodovias federais asfaltadas,não entregou o Brasil para nenhum país,"
2023-04-18 00:30:50+00:00,1648121874461736961,"@alekiepoulain Verborragia na diplomacia costuma pegar mal, jajá o Brasil começa a tomar bola preta da UE e dos EUA, com a estupidez que já estão fazendo na economia vai ser uma beleza!"
2023-04-18 00:22:31+00:00,1648119783940841473,O JN de hoje foi uma prévia caso Lula continue ouvindo Amorim e seus radicais. Lula focando na economia e NO BRASIL não tem erro. JN é o veículo mais de boa E MAIS IMPORTANTE em relação ao Lula.
2023-04-18 00:18:11+00:00,1648118690678726656,"@o_antagonista Saudades do melhor PR da historia do Brasil e do melhor ministro da economia, Guedes. A velha mídia imunda e o STF são culpados de nossa desgraça. Lula é um bandido uma tragédia anunciada"
2023-04-18 00:16:48+00:00,1648118342429843456,@PTnoSenado @LulaOficial No caso Ucrânia e Rússia. Não estou defendendo nem A nem B. Mas o país protagonista da economia é a China e será por uns 50 anos. E o Brics está com a China.E são economias emergentes. O Brasil que ficou e está parado e não define o que quer. Alguém tinha que tomar está decisão.
2023-04-18 00:15:14+00:00,1648117949104889857,@gcamarotti Não estou defendendo nem A nem. Mas o país protagonista da economia é  a China e será por uns 50 anos. E o Brics está com a China.  E são economias emergentes. O Brasil que ficou e está parado e não define o que quer. Alguém tinha que tomar está decisão.
2023-04-18 00:13:54+00:00,1648117614206504960,"@88aa99bb @marflecha @Amandavettorazz O presidente eleito graças a sua omissão se gabou outro dia de ser o único a assumir um mandato antes da posse.
A economia ia bem até o dia da eleição.
Se o Brasil caiu, agradeça a sua covardia por não ter escolhido um lado, e se escolheu o lado do presidente que tá aí, aguente."
2023-04-18 00:11:05+00:00,1648116904475648000,"Eu como brasileiro, e acredito que muitos outros, adoraríamos ouvir um Simpósio do STF, aqui no Brasil, para falar sobre :
Democracia;
Invasões do MST em terras privadas;
Apoio do Presidente Lula ao MST;
Economia atual;
Política externa do Presidente Lula;
etc...."
2023-04-18 00:08:34+00:00,1648116273161576450,@GloboNews @ValdoCruz @estudioi @AndreiaSadi Não estou defendendo nem A nem. Mas o país protagonista da economia é  a China e será por uns 50 anos. E o Brics está com a China.  E são economias emergentes. O Brasil que ficou e está parado não define o que quer. Alguém tinha que tomar está decisão.
2023-04-18 00:08:30+00:00,1648116257416261636,"@_robertomotta Ela só confirma a tese do Lula. Se essa taxa fosse benéfica à economia real do Brasil, como americana, ela criticaria. Os senhores do mercado vivem a ilusão da América dos filmes, do Super-Man, do Batman. Os EUA vivem da 'eterna' dependência alheia."
2023-04-18 00:08:27+00:00,1648116240966119424,"@dw_espanol Curioso ahora Brasil está trabajando con china y Rusia de buena forma, vienen los gringos a formarle problema. Ya sabemos que su economía va de la mano de la guerra y el caos."
2023-04-18 00:07:53+00:00,1648116100452823040,@GloboNews @gcamarotti @CesarTralli Não estou defendendo nem A nem. Mas o país protagonista da economia é  a China e será por uns 50 anos. E o Brics está com a China.  E são economias emergentes. O Brasil que ficou e está parado não define o que quer. Alguém tinha que tomar está decisão.
2023-04-18 00:00:23+00:00,1648114214207205377,"22% das importações do Brasil vem dos Estados Unidos, e para muita gente que não entende nada de economia não tem problema nossa relação com eles piorar"
2023-04-17 23:58:19+00:00,1648113694692323330,Economia azul: RJ buscará startups para enfrentar desafios ambientais | Agência Brasil https://t.co/z2rA4tP9Wr
2023-04-17 23:57:22+00:00,1648113454471888896,Tivemos um ótimo papo sobre o desenvolvimento econômico e estratégico do Brasil através da ciência e tecnologia e como isso pode se articular com o cooperativismo e com a economia solidária a nível nacional.
2023-04-17 23:55:53+00:00,1648113082294497280,"@CNNBrasil Ué..bastsa dar um google sobre o estado com pior educacao e economia do brasil?
Entao, errado, o desembargador NAO esta. Fato, oras."
2023-04-17 23:54:20+00:00,1648112692081590273,NÃO TEM COMO RACIOCINAR COM ALGUÉM AUTORIDADES MONETÁRIA ECONOMISTA QUE ACHAR QUE A ECONOMIA DO BRASIL ESTÁ IGUAL DOS EUA OU PIOR QUE ISSO TOMAR DECISÕES SEMELHANTES A DOS EUA. Estados Unidos parece que vem enfrentando uma explosão de consumo enquanto no Brasil uma Escassez...
2023-04-17 23:47:38+00:00,1648111004285300737,"Inflação abaixo da meta, ações da bolsa subindo, dólar 4,90, Brasil se destacando no cenário mundial e recuperação do capital diplomático??? Mas o lula não ia destruir a economia do país???"
2023-04-17 23:47:22+00:00,1648110935440064515,"A criação do laboratório de gemas vai abrir o mercado internacional para os produtores de pedras preciosas do Brasil, com foco principal na China e Ásia e potencial para atingir outras partes do mundo.

Leia mais: https://t.co/pOhgOKIE2S

#Economia #Desenvolvimento"
2023-04-17 23:45:10+00:00,1648110383352147969,"@PedroRonchi2 NO BRASIL, A CULPA FOI DE BOLSONARO, E NO RESTO DO MUNDO, A ECONOMIA TEVE DESACELERAÇÃO  NA PANDEMIA,  POR QUÊ?
QUANDO A PANDEMIA ARREFECEU, A ECONOMIA BRASILEIRA APRESENTOU UMA DAS MAIORES PERFORMANCES DO MUNDO, ELOGIADA PELA BLOOMBERG, FMI E FEDERAL RESERVE, MÉRITO DE QUEM?"
2023-04-17 23:40:37+00:00,1648109240278478850,"O dia que esse monte de cadelinha de imperialista entender que o Brasil não depende dos EUA e da UE pra ✨ nada ✨ eles  vão de Olavo

Nossa economia é autosustentavel, nossos principais parceiros são do BRICS, e não existe embargo que atrapalhe a gente

BRASIL É GIGANTE CARALHO"
2023-04-17 23:38:09+00:00,1648108619374755845,"@eugushenrique @Misterioso37455 @eixopolitico Pro Brasil até agora nenhuma, Mas pra Rússia sim, Irã se entrar também. 

Agora seja sincero qual seu real problema com o Dólar? Nenhuma economia dos BRICS tem peso pra ter uma moeda forte.

Se vc tem algo contra o Dólar, tem o Euro também amigo, Alguma moeda tem que ser."
2023-04-17 23:36:59+00:00,1648108326016753665,"Arcabouço fiscal deve encontrar resistência e ‘fogo amigo’ de partidos de esquerda no Congresso
#ArcabouçoFiscal #Brasil #Economia
https://t.co/rHa3Lm7Txb"
2023-04-17 23:34:09+00:00,1648107612842475522,"Brasil y China firman acuerdo para comerciar en sus propias monedas.
El real brasileño se reevalua.
EEUU calienta motores en Taiwan...
La reevaluación del Real impacta en las empresas exportadoras de alimentos en Brasil.
Si arranca un conflicto China iniciaría economía de Guerra."
2023-04-17 23:33:11+00:00,1648107369333751811,@miriamleitao @maprando1979 Para quem tinha um ministro como o Guedes e ouvia essa senhora a todo tempo falando m…. sobre o melhor ministro da economia que  o Brasil já teve. Agora temos um poste que está acabando com Brasil falando em gastar sem mesmo saber de onde virá o dinheiro https://t.co/mw2wCLLUC4
2023-04-17 23:27:42+00:00,1648105987247595523,@mvitorodrigues Maior aliado econômico do Brasil hoje é a China. EUA através da Lava Jato destruiu a economia brasileira. Próxima
2023-04-17 23:27:22+00:00,1648105904749916160,@GayerGus O pior é a demissão em massa que está ocorrendo nas empresas. Alinhamento com a China e a Rússia será a destruição da economia e da liberdade no Brasil. Empresários já estão se preparando para partir.
2023-04-17 23:24:18+00:00,1648105130565197825,"Governo do Rio lança o Blue Rio, programa colaborativo de economia azul | Agência Brasil https://t.co/lStzYcDrMd"
2023-04-17 23:20:17+00:00,1648104120283217920,@Guiimoraless @rodrigoluisvelo @RafaZan8 @revistaoeste Exatamente o que pensei. Pra que emprestar por aí se nossa condição em economia era boa e rumando para ótima..
2023-04-17 23:16:47+00:00,1648103240469213186,"AVISO A LOS PUCHOS
El ministro ruso LAVROV viaja a Brasil, Venezuela,  Nicaragua y Cuba, para incrementar la cooperación entre los países, con enfoques en política, comercio y economía, educación, cultura, humanidades y otros ámbitos.
#NoPudieronNiPodrán"
2023-04-17 23:15:50+00:00,1648103000014049281,"@CNNBrasil Aquele que afirmou que B@l$$00r00 iria resignificar a política no Brasil: 

Esse aprendiz de Chacrinha já deu palpites em economia, educação, e agora, em geopolítica. 

O esplendor da nulidade multifacetada."
2023-04-17 23:15:12+00:00,1648102841922502657,"Governo e bancos vão criar grupo de trabalho para discutir causas dos juros altos do rotativo, diz Febraban | Economia +News: https://t.co/vXMz1nNgUd | #NewsTuneinBR https://t.co/EdhFSS23aQ"
2023-04-17 23:14:07+00:00,1648102571586859010,"Cara. Olha o tamanho do problema..... Que o atual governo, está colocando a economia do Brasil!  É muito sem noção ou quer que o Brasil, afunde cada vez mais! 🤦🤦🤦"
2023-04-17 23:14:02+00:00,1648102549256298499,Y donde esta la mentira? para nadie es un secreto que quien mas se beneficia de la guerra en Ucrania es EEUU a costillas de la economía europea (China es un segundo beneficiado) lo que pasa es que por ser mejor aliado para Brasil a este ultimo poco o nada le importa tirarle.
2023-04-17 23:11:23+00:00,1648101880701104129,"@GayerGus Excelente, Gustavo! 👏🏻👏🏻👏🏻
Obrigada!
Não consigo acreditar que em 3 meses, o Brasil passou de ECONOMIA ESTÁVEL e PROMISSOR CRESCIMENTO para PAÍS ENDIVIDADO! 🤦🏻‍♀️
Exigimos explicação!!!
A mini-STRA Simone dizendo que não existe teto de gastos...
🆘️🇧🇷"
2023-04-17 23:10:58+00:00,1648101778020245505,"5. ""O que Sergey Lavrov, chanceler russo, busca no Brasil - e na América Latina | Revista Fórum""
https://t.co/BwQ0R6Y6pS
""""Fortalecer a cooperação mutuamente benéfica de nossos países na política, comércio, economia, educação, esfera humanitária, cultura e outros campos""."""
2023-04-17 23:09:52+00:00,1648101499015159808,"@PonzistaAnti @SergioChouza Lo dudo, la negra sabe más de economía que Chouza. Es hábil para hacer negocios y prosperó con su escuela de modelos; tiene otra en Brasil que dirige una hermana de ella."
2023-04-17 23:04:11+00:00,1648100069739053057,"@LuMarques05 @s79255040 @GuilhermeBr4zil @SICNoticias Chego à conclusão que o Brasil que eu conheço só mostraram para mim. Desemprego, milhares a dormir nas ruas, casas sem água corrente e esgotos, assistência hospitalar que não funciona. Enfim… um país com uma economia fortíssima. Qual é o PIB por habitante?"
2023-04-17 23:03:06+00:00,1648099798015434752,#Economia Foi no governo  militar de 64 em diante que o brasil se lançou com a  Embrapa e se tornou um grande ator na agro pecuaria.
2023-04-17 23:02:39+00:00,1648099684743774209,"Ibaneis envia proposta que regulamenta carreira de policial penal no DF https://t.co/zrouIJI9wM

#radardf #distritofederal #brasil #df #gdf #ultimasnoticias #noticias #radarpolitico #politica #economia #mundo #culturaeesporte #cidadesdodf #entorno"
2023-04-17 23:02:39+00:00,1648099681958785024,"Governo repensa estratégia para alterar saque-aniversário do FGTS https://t.co/PXZwYQFbl9

#radardf #distritofederal #brasil #df #gdf #ultimasnoticias #noticias #radarpolitico #politica #economia #mundo #culturaeesporte #cidadesdodf #entorno"
2023-04-17 23:01:34+00:00,1648099411463925760,"Comprem Shopee, Shein, Aliexpress... comprem muito! E quando chegar a mercadoria e você for taxado, devolva e explique o motivo, o reembolso é garantido!

Em pouco tempo o que vocês acham que alguém do governo chinês vai dizer para o ministro da economia do Brasil?"
2023-04-17 22:59:28+00:00,1648098882990080000,@Saymon37316165 Desde quando a economia do Brasil tá quebrada! Esse ano o Brasil pulou da 12 posição para 9 posição de maiores economia!
2023-04-17 22:58:39+00:00,1648098676101742592,"@GraziBRosa @mendlowicz E outra não generalize, muitos empreendedores são leais e não contrabandistas, pq se fosse todos do jeito que falou a cima o Brasil estaria QUEBRADISSIMO, então empreendedores, fábricas brasileiras e etc segura mais de 50% a economia do Brasil!"
2023-04-17 22:58:18+00:00,1648098589011312640,"O Brasil precisa de investimentos em infraestrutura para voltar a crescer e de compromissos internacionais, visando acelerar a transição no rumo de uma economia de baixo carbono. O Rio Grande Norte precisa ir junto! Avançar é preciso! @fatimabezerra @LulaOficial"
2023-04-17 22:57:26+00:00,1648098373126217728,@PadraoAlexandre @MariaSocorroBr4 Não entendi...um funil.........Brasil...não funciona assim......não move a economia.........alguém levou vantagem....alguém lucrou.....
2023-04-17 22:57:00+00:00,1648098260253569024,"@marianasosa25 Te estoy mostrando que las exportaciones de Australia y Brasil crecieron 6 veces más rápido. Quizás tenga que ver con las retenciones y los cepos…

Con la economía abierta e impuestos bajos podrían tener un nivel de servicio público superior pero tiene que sacar a los ladrones…"
2023-04-17 22:56:22+00:00,1648098104690855942,"Lula foi a China e fez ótimos acordos para o Brasil, crescimento compartilhado, EUA não gostaram aqueles que financiaram Moro e Bolsonaro entreguistas para dar golpe contra o Brasil, destruindo economia, quebrando as maiores empresas, desempregado milhares, prejudicando o POVO."
2023-04-17 22:55:53+00:00,1648097981327867907,"Economia de baixo carbono é oportunidade para reindustrializar o Brasil.

Projetos desenvolvidos no país para a produção do combustível limpo representam uma janela de oportunidade para descarbonizar a indústria. https://t.co/KjurcbBUw1

#MaisBrasilNoMundo #HM23 https://t.co/RfyPEXjYue"
2023-04-17 22:54:55+00:00,1648097739572387842,"La ""yuanización"" de la economía en #LatAm empezará por Brasil y lentamente engullira a toda américa del sur y paulatinamente subirá hasta México"
2023-04-17 22:51:54+00:00,1648096976989298689,"@PadraoAlexandre Paradoxalmente, só o caos econômico gerado pelo próprio lulopetismo pode agora afastar o lulopetismo do poder. Não é possível torcer ao mesmo tempo para que a Economia dê certo e o lulopetismo saia do poder. Para o lulopetismo sair, o Brasil, infelizmente, precisa quebrar."
2023-04-17 22:51:12+00:00,1648096804066435075,"@Carcaradaseca13 @FabioClickTime @saritacoelho Pode ter certeza que qualquer número positivo na economia, temos que agradecer o presidente do banco central que está empurrando a economia com a barriga."
2023-04-17 22:46:53+00:00,1648095717276241920,"@pauloguedesfc Senhor Paulo Guedes, obrigada por tudo que fez pelo Brasil e por nós com muita competência!
O melhor Economista do mundo! 
Como te admiro!
Desejo vê-lo no Ministério da Economia novamente! 🙏🙏🙌🇧🇷"
2023-04-17 22:46:12+00:00,1648095544336629763,"O Brasil tinha que se preocupar com a abrir a economia para o capital americano e europeu entrar.

Em paralelo, realizar parcerias com os países democráticos e capitalistas da América do Sul, para garantir uma hegemonia regional.

Mas não, tá indo lá dar opinião em guerra alheia."
2023-04-17 22:43:17+00:00,1648094810840891393,@senadorhumberto Senador o Sr sabe como está a economia no chão do Brasil ?
2023-04-17 22:42:25+00:00,1648094591160033280,"@LucasDallasF @Horle5 @Snando14053015 @hoje_no O certo seria dizer que o Brasil  precisa  ser independente de outras economia!  mas mantendo  parcerias que desenvolva o crescimento  de ambos os lados sem gerar  uma dependência coisa que a China faz muito bem, e isso começou  aqui no Brasil desde  2006.

Então deve se preoc/S!"
2023-04-17 22:39:49+00:00,1648093939050721281,"@LeoniceMariana1 Eu vou comprar é mais! E quando chegar vou devolver o pacote e pedir reembolso... agora imagina o Brasil inteiro fazendo isso, será que seria pouca ou muita pressão das lojas chineses em cima do seu governo para ""falar"" com o ministru da economia brasileira?"
2023-04-17 22:27:20+00:00,1648090795973410817,Arcabouço fiscal deve ser entregue ao Congresso na terça com mudanças  #economia
2023-04-17 22:24:49+00:00,1648090161970913281,"Mientras la economía de Brasil es una incógnita, Lula da Silva le tiende la mano a China, Rusia e Irán - Infobae https://t.co/ycfEr5ZTHU"
2023-04-17 22:22:56+00:00,1648089690900242435,"@Lu1zAndr4d3 @hoje_no Prefiro Brasil alinhado aos brics, o modelo americano é um modelo que vai entrar em colapso em pouco tempo!
Biden está fazendo um ótimo trabalho quanto à destruir a economia americana!"
2023-04-17 22:22:34+00:00,1648089597899882500,"#LulaPresidente 
#LulaUmBrasilParaTodos
#BrasilUniãoEReconstrução
#parceiriascomerciais
#economia
#cidadania
#direitos
#democracia
#brasil https://t.co/cGNc4s4DhN"
2023-04-17 22:17:25+00:00,1648088301033897985,"Talvez o Brasil tenha chances se prepararem a mente dessa geração e isso vai além da economia e odiarem o L. Pois até podem derrubarem o L de hj, mas outros surgirão e se um deles acertar na economia e a mente dessa geração não estiver preparada, o Brasil será vermelho e “feliz”."
2023-04-17 22:15:22+00:00,1648087784710721536,"... Por fim celebraram acordo em que a China enfia no Brasil uma série de protocolo e mais custos para continuar a aceitar a nossa carne de gado.  A imprensa te será como uma grande conquista o que na verdade foi um grande assalto a nossa economia e soberania.
- @faimonjorner"
2023-04-17 22:14:45+00:00,1648087630095974400,"Exatamente, eu nao quero saber o que o Bolsonaro fez, a minha pergunta é: o que o Lula está fazendo pelo Brasil, economia, segurança e diminuição da maq do Estado? O que?"
2023-04-17 22:14:01+00:00,1648087445005582342,"@josy_collares Tudo de propósito, estão seguindo uma listinha de como destruir o Brasil, economia, tradição, religião, famílias, e por fim sua reputação"
